{
  "schemaVersion": 1,
  "personaId": "p-harness",
  "description": "Neutral test harness persona without a stored profile: a current account only, no contracts, income equal to spending.",
  "generator": {"seed": 2026102007, "generatorVersion": 1},
  "simulatedDate": "2026-10-20",
  "accounts": [
    {"id": "554dc681-70f8-3c59-8ba0-f80f29c86551", "type": "CURRENT", "name": "Current account", "iban": "DE00282751395244234260", "openingDate": "2025-07-01", "openingBalance": "1106.13"}
  ],
  "contracts": [],
  "transactions": [
    {"id": "b835d741-7044-3fa3-afb8-3a2d2ed2fd29", "accountId": "554dc681-70f8-3c59-8ba0-f80f29c86551", "bookingDate": "2025-07-01", "amount": "2000.00", "category": "SALARY", "counterparty": "Example Employer", "reference": "Salary", "recurrenceId": "salary"},
    {"id": "e6f0b5ab-5db6-3696-bd8a-10806f0af206", "accountId": "554dc681-70f8-3c59-8ba0-f80f29c86551", "bookingDate": "2025-07-01", "amount": "-800.00", "category": "RENT", "counterparty": "Example Housing Co.", "reference": "Rent", "recurrenceId": "rent"},
    {"id": "1eb69da2-5221-3de6-998b-15d543cba797", "accountId": "554dc681-70f8-3c59-8ba0-f80f29c86551", "bookingDate": "2025-07-02", "amount": "-65.45", "category": "LEISURE", "counterparty": "Example Cinema", "reference": "Card payment"},
    {"id": "9b6bbf76-4444-3923-be96-6e41a0c03626", "accountId": "554dc681-70f8-3c59-8ba0-f80f29c86551", "bookingDate": "2025-07-05", "amount": "-60.00", "category": "UTILITIES", "counterparty": "Example Power Utility", "reference": "Electricity", "recurrenceId": "electricity"},
    {"id": "d19d144c-d133-355c-a200-fa5b2ea41a4a", "accountId": "554dc681-70f8-3c59-8ba0-f80f29c86551", "bookingDate": "2025-07-05", "amount": "-140.38", "category": "HEALTH", "counterparty": "City Pharmacy", "reference": "Card payment"},
    {"id": "73275b45-dcb2-343d-b59c-126a179f03fc", "accountId": "554dc681-70f8-3c59-8ba0-f80f29c86551", "bookingDate": "2025-07-07", "amount": "-60.45", "category": "CASH_WITHDRAWAL", "counterparty": "Cash machine", "reference": "Cash withdrawal"},
    {"id": "2a81fc0c-77fc-310a-9297-7826741528c5", "accountId": "554dc681-70f8-3c59-8ba0-f80f29c86551", "bookingDate": "2025-07-09", "amount": "-77.93", "category": "CASH_WITHDRAWAL", "counterparty": "Cash machine", "reference": "Cash withdrawal"},
    {"id": "5cb4a96d-3cd5-3936-a3a4-43568539d059", "accountId": "554dc681-70f8-3c59-8ba0-f80f29c86551", "bookingDate": "2025-07-10", "amount": "-30.00", "category": "TELECOM", "counterparty": "Example Mobile", "reference": "Phone and internet", "recurrenceId": "phone"},
    {"id": "d82e6b94-2a9e-3949-86c8-e1f60998fb5f", "accountId": "554dc681-70f8-3c59-8ba0-f80f29c86551", "bookingDate": "2025-07-13", "amount": "-126.89", "category": "GROCERIES", "counterparty": "Corner Grocery", "reference": "Card payment"},
    {"id": "2f48f2b8-688a-3913-a1c9-d12816ad8d61", "accountId": "554dc681-70f8-3c59-8ba0-f80f29c86551", "bookingDate": "2025-07-16", "amount": "-127.39", "category": "LEISURE", "counterparty": "Example Cinema", "reference": "Card payment"},
    {"id": "ea25510a-5eeb-3abd-94f6-580ce40e1f88", "accountId": "554dc681-70f8-3c59-8ba0-f80f29c86551", "bookingDate": "2025-07-19", "amount": "-122.88", "category": "CASH_WITHDRAWAL", "counterparty": "Cash machine", "reference": "Cash withdrawal"},
    {"id": "405527ee-4743-3ce3-a0b8-184ba023d8f8", "accountId": "554dc681-70f8-3c59-8ba0-f80f29c86551", "bookingDate": "2025-07-23", "amount": "-148.36", "category": "GROCERIES", "counterparty": "Fresh Market", "reference": "Card payment"},
    {"id": "e8ba1ac9-30ba-3be1-a482-7a77b33558d9", "accountId": "554dc681-70f8-3c59-8ba0-f80f29c86551", "bookingDate": "2025-07-27", "amount": "-28.47", "category": "GROCERIES", "counterparty": "Corner Grocery", "reference": "Card payment"},
    {"id": "8fb73c5e-9346-3b05-9a29-3963cafcfe69", "accountId": "554dc681-70f8-3c59-8ba0-f80f29c86551", "bookingDate": "2025-07-29", "amount": "-71.93", "category": "GROCERIES", "counterparty": "Fresh Market", "reference": "Card payment"},
    {"id": "3c9f7813-e93f-3494-ab2b-828f38f0e92e", "accountId": "554dc681-70f8-3c59-8ba0-f80f29c86551", "bookingDate": "2025-07-31", "amount": "-139.87", "category": "DINING", "counterparty": "Example Bistro", "reference": "Card payment"},
    {"id": "fe72695f-f6fe-3d27-b940-39d2bc237702", "accountId": "554dc681-70f8-3c59-8ba0-f80f29c86551", "bookingDate": "2025-08-01", "amount": "2000.00", "category": "SALARY", "counterparty": "Example Employer", "reference": "Salary", "recurrenceId": "salary"},
    {"id": "aa84c369-85a5-3b50-bea9-55d795794c9c", "accountId": "554dc681-70f8-3c59-8ba0-f80f29c86551", "bookingDate": "2025-08-01", "amount": "-800.00", "category": "RENT", "counterparty": "Example Housing Co.", "reference": "Rent", "recurrenceId": "rent"},
    {"id": "7610610d-433e-3ef4-9cd8-1bff5007042c", "accountId": "554dc681-70f8-3c59-8ba0-f80f29c86551", "bookingDate": "2025-08-03", "amount": "-55.45", "category": "GROCERIES", "counterparty": "Fresh Market", "reference": "Card payment"},
    {"id": "43530d61-bea5-39fe-87ea-3be1b8ba724f", "accountId": "554dc681-70f8-3c59-8ba0-f80f29c86551", "bookingDate": "2025-08-05", "amount": "-60.00", "category": "UTILITIES", "counterparty": "Example Power Utility", "reference": "Electricity", "recurrenceId": "electricity"},
    {"id": "413ab240-2024-34c3-8510-aa400f260546", "accountId": "554dc681-70f8-3c59-8ba0-f80f29c86551", "bookingDate": "2025-08-07", "amount": "-134.36", "category": "GROCERIES", "counterparty": "Corner Grocery", "reference": "Card payment"},
    {"id": "0245f953-d66a-3d99-bfce-19320d11cc94", "accountId": "554dc681-70f8-3c59-8ba0-f80f29c86551", "bookingDate": "2025-08-09", "amount": "-133.29", "category": "GROCERIES", "counterparty": "Fresh Market", "reference": "Card payment"},
    {"id": "15a8cbb9-db87-3c4d-a704-3967c83635cc", "accountId": "554dc681-70f8-3c59-8ba0-f80f29c86551", "bookingDate": "2025-08-10", "amount": "-30.00", "category": "TELECOM", "counterparty": "Example Mobile", "reference": "Phone and internet", "recurrenceId": "phone"},
    {"id": "cf99039f-3873-3284-a9c6-8ac622ce94a3", "accountId": "554dc681-70f8-3c59-8ba0-f80f29c86551", "bookingDate": "2025-08-11", "amount": "-57.05", "category": "LEISURE", "counterparty": "Example Cinema", "reference": "Card payment"},
    {"id": "a3199627-06a1-3550-846d-66138348aebe", "accountId": "554dc681-70f8-3c59-8ba0-f80f29c86551", "bookingDate": "2025-08-13", "amount": "-68.25", "category": "CASH_WITHDRAWAL", "counterparty": "Cash machine", "reference": "Cash withdrawal"},
    {"id": "cacd10d0-8793-3ef8-b96a-456c8eacbfbb", "accountId": "554dc681-70f8-3c59-8ba0-f80f29c86551", "bookingDate": "2025-08-15", "amount": "-94.36", "category": "SHOPPING", "counterparty": "Example Department Store", "reference": "Card payment"},
    {"id": "7f80bd24-fcb5-35e3-b6dd-db7ae6be654d", "accountId": "554dc681-70f8-3c59-8ba0-f80f29c86551", "bookingDate": "2025-08-18", "amount": "-56.51", "category": "SHOPPING", "counterparty": "Example Online Shop", "reference": "Online purchase"},
    {"id": "ec72d102-ef4f-3231-b173-66cd31b0da85", "accountId": "554dc681-70f8-3c59-8ba0-f80f29c86551", "bookingDate": "2025-08-20", "amount": "-150.87", "category": "DINING", "counterparty": "Example Bakery", "reference": "Card payment"},
    {"id": "a5bce950-6973-3525-a3b4-0238a43dd8d0", "accountId": "554dc681-70f8-3c59-8ba0-f80f29c86551", "bookingDate": "2025-08-24", "amount": "-41.58", "category": "LEISURE", "counterparty": "Example Cinema", "reference": "Card payment"},
    {"id": "d620b9a3-b8f6-3233-b4f0-88aa45a5d7e8", "accountId": "554dc681-70f8-3c59-8ba0-f80f29c86551", "bookingDate": "2025-08-26", "amount": "-105.56", "category": "GROCERIES", "counterparty": "Corner Grocery", "reference": "Card payment"},
    {"id": "c712b37e-0727-373e-8298-8f0d6c539dd8", "accountId": "554dc681-70f8-3c59-8ba0-f80f29c86551", "bookingDate": "2025-08-28", "amount": "-127.42", "category": "GROCERIES", "counterparty": "Fresh Market", "reference": "Card payment"},
    {"id": "8908ddc7-b8d3-3b01-aadf-20f34bc72c72", "accountId": "554dc681-70f8-3c59-8ba0-f80f29c86551", "bookingDate": "2025-08-30", "amount": "-85.30", "category": "SHOPPING", "counterparty": "Example Online Shop", "reference": "Online purchase"},
    {"id": "b25c84a6-0d98-38bd-a8f4-a9d39d9f657a", "accountId": "554dc681-70f8-3c59-8ba0-f80f29c86551", "bookingDate": "2025-09-01", "amount": "2000.00", "category": "SALARY", "counterparty": "Example Employer", "reference": "Salary", "recurrenceId": "salary"},
    {"id": "706a8d15-7617-3c2a-a662-806ffee45819", "accountId": "554dc681-70f8-3c59-8ba0-f80f29c86551", "bookingDate": "2025-09-01", "amount": "-800.00", "category": "RENT", "counterparty": "Example Housing Co.", "reference": "Rent", "recurrenceId": "rent"},
    {"id": "4ef7274a-0ac9-30f2-8df1-471ad8bc1861", "accountId": "554dc681-70f8-3c59-8ba0-f80f29c86551", "bookingDate": "2025-09-03", "amount": "-43.91", "category": "GROCERIES", "counterparty": "Fresh Market", "reference": "Card payment"},
    {"id": "1ffd4db0-cce2-37ca-b607-df41592d157b", "accountId": "554dc681-70f8-3c59-8ba0-f80f29c86551", "bookingDate": "2025-09-05", "amount": "-60.00", "category": "UTILITIES", "counterparty": "Example Power Utility", "reference": "Electricity", "recurrenceId": "electricity"},
    {"id": "bf3928d8-c7bb-3671-94f9-62524704dd83", "accountId": "554dc681-70f8-3c59-8ba0-f80f29c86551", "bookingDate": "2025-09-06", "amount": "-133.67", "category": "HEALTH", "counterparty": "City Pharmacy", "reference": "Card payment"},
    {"id": "079ff4ec-95f6-3916-8963-57ca3432083d", "accountId": "554dc681-70f8-3c59-8ba0-f80f29c86551", "bookingDate": "2025-09-09", "amount": "-123.98", "category": "HEALTH", "counterparty": "City Pharmacy", "reference": "Card payment"},